id,title,price,promo_price,url
4692755,Средство для мытья посуды CJ LION Charmgreen овощей и фруктов гранат 900 г,856,513,https://www.detmir.ru/product/index/id/4692755/
3118608,Средство Babyline для мытья детской посуды 250мл DB044/N,129,,https://www.detmir.ru/product/index/id/3118608/
3856235,Ёршики ПОМА желтый Пома,277,249,https://www.detmir.ru/product/index/id/3856235/
3374170,Ершик для бутылочек Nuk 2в1 Голубой 10750747,729,,https://www.detmir.ru/product/index/id/3374170/
4594630,Гель-бальзам для мытья посуды Synergetic Synergetic Pure 0% 0.5л 103064,269,,https://www.detmir.ru/product/index/id/4594630/
3413270,Ершик для бутылочек Babyono Серый 721,235,,https://www.detmir.ru/product/index/id/3413270/
3473567,Таблетки Top House для посудомоечных машин в водорастворимой плёнке 24 шт,680,496,https://www.detmir.ru/product/index/id/3473567/
3668107,Гель для мытья посуды Neutrale гипоаллергенный без запаха и фосфатов Эко 400мл,329,263,https://www.detmir.ru/product/index/id/3668107/
3413258,Набор ершиков Babyono для бутылочек и сосок Голубой 728/01,490,,https://www.detmir.ru/product/index/id/3413258/
4693033,Средство для мытья посуды CJ LION Charmgreen овощей и фруктов зеленый чай 310 мл,311,217,https://www.detmir.ru/product/index/id/4693033/
4681986,Средство для мытья посуды CJ LION Charmgreen овощей и фруктов древесный уголь 1.2 кг,782,547,https://www.detmir.ru/product/index/id/4681986/
3496830,Спрей для мытья посуды Химола Фермент-15 активная пена,199,,https://www.detmir.ru/product/index/id/3496830/
4682099,Средство для мытья посуды CJ LION Charmgreen овощей и фруктов зеленый чай 500 г,566,345,https://www.detmir.ru/product/index/id/4682099/
4692760,Средство для мытья посуды CJ LION Chamgreen bottle овощей и фруктов Японский абрикос 500г,527,335,https://www.detmir.ru/product/index/id/4692760/
3654752,Ершик Bebe Confort для мытья бутылочек со спонжем 3102206700 Bebe Confort,485,339,https://www.detmir.ru/product/index/id/3654752/
3810589,Средство для мытья посуды Солнце и луна Eco эфирное масло грейпфрута 0.5л,169,,https://www.detmir.ru/product/index/id/3810589/
4595067,Гель-бальзам для мытья посуды Synergetic Эвкалипт-Горный чабрец 0.5л,269,,https://www.detmir.ru/product/index/id/4595067/
3143782,Мыло для кухни посуды и рук Hanbok жидкое Белый лотос 500мл,159,,https://www.detmir.ru/product/index/id/3143782/
3543318,Очиститель TOPPERR посудомоечных машин 3308,409,327,https://www.detmir.ru/product/index/id/3543318/
4595068,Гель-бальзам для мытья посуды Synergetic Эвкалипт-Горный чабрец 1л,459,,https://www.detmir.ru/product/index/id/4595068/
4595059,Гель-бальзам для мытья посуды Synergetic Розмарин-Листья смородины 1л,459,,https://www.detmir.ru/product/index/id/4595059/
4455728,Средство для мытья посуды Sanita Clear 510 г,249,148,https://www.detmir.ru/product/index/id/4455728/
4784035,Ерш для мытья посуды Доляна с микрофиброй натуральная щетина,449,139,https://www.detmir.ru/product/index/id/4784035/
4568912,Набор ёршиков Пома для мытья клапанов и трубочек,256,230,https://www.detmir.ru/product/index/id/4568912/
3885630,Гель для посуды Rossinka малина-мята 500мл,199,,https://www.detmir.ru/product/index/id/3885630/
3413256,Ершик для соломинок и трубочек Babyono 733,306,,https://www.detmir.ru/product/index/id/3413256/
4784032,Ерш для мытья посуды Доляна с деревянной ручкой,213,66,https://www.detmir.ru/product/index/id/4784032/
3143781,Средство для мытья посуды и рук Hanbok 2в1 Ягоды Годжи и красный женьшень 500мл,219,,https://www.detmir.ru/product/index/id/3143781/
3175533,Спрей для мытья фруктов и овощей DR.TUTTELLE с экстрактом мыльнянки 250мл,339,255,https://www.detmir.ru/product/index/id/3175533/
3374169,Ершик для бутылочек Nuk 2в1 Желтый 10750643,645,399,https://www.detmir.ru/product/index/id/3374169/
3483522,Средство для мытья посуды Fairy Foam активная пена 350мл,599,,https://www.detmir.ru/product/index/id/3483522/
3483523,Средство для мытья посуды Fairy Foam активная пена 375мл,549,,https://www.detmir.ru/product/index/id/3483523/
3487571,Соль Postiron для посудомоечных машин,349,,https://www.detmir.ru/product/index/id/3487571/
3487585,Средство для мытья посуды Postiron 0.65л,279,,https://www.detmir.ru/product/index/id/3487585/
3487586,Средство для мытья посуды Postiron 2л,545,517,https://www.detmir.ru/product/index/id/3487586/
3487587,Средство для мытья посуды Postiron 0.65л,279,,https://www.detmir.ru/product/index/id/3487587/
3487590,Средство для мытья посуды Postiron 0.65л,279,,https://www.detmir.ru/product/index/id/3487590/
3543245,Таблетки TOPPERR для посудомоечных машин 10в1 20шт 3303,1009,807,https://www.detmir.ru/product/index/id/3543245/
3555372,Гель для мытья посуды Bonny детской с экстрактом алоэ,229,,https://www.detmir.ru/product/index/id/3555372/
3559286,Гель для мытья посуды Papa Care Premium,419,,https://www.detmir.ru/product/index/id/3559286/
3654753,Набор ершиков Bebe Confort 2 в 1 для мытья сосок и бутылочек 3102207100 Bebe Confort,535,,https://www.detmir.ru/product/index/id/3654753/
3665682,Гель для мытья посуды Palmia Automatica Proff для посудомоечных машин 10 л,3793,2237,https://www.detmir.ru/product/index/id/3665682/
3665686,Cредство для мытья посуды Palmia Mojito с ароматом мохито 5 л,1613,983,https://www.detmir.ru/product/index/id/3665686/
3665689,Гель для мытья посуды Palmia Vanilla Ice-Cream с ароматом ванильного мороженого 5 л,1613,983,https://www.detmir.ru/product/index/id/3665689/
3763279,Коврик для сушки посуды Brabantia Sink Side силиконовый,6879,6191,https://www.detmir.ru/product/index/id/3763279/
3763285,Щетка для мытья посуды Brabantia Sink Side с держателем на присоске Brabantia,2919,,https://www.detmir.ru/product/index/id/3763285/
3763287,Щетка для мытья посуды Brabantia Sink Side с держателем на присоске Brabantia,2919,,https://www.detmir.ru/product/index/id/3763287/
3766239,Гель для мытья посуды Jundo Juicy Lemon и детских принадлежностей 800мл,400,283,https://www.detmir.ru/product/index/id/3766239/
3792984,Губка Paul Masquin с абразивным слоем 2шт Paul Masquin,259,,https://www.detmir.ru/product/index/id/3792984/
3793549,Ершик Paul Masquin для бутылок Paul Masquin,459,,https://www.detmir.ru/product/index/id/3793549/
3793555,Щетка Paul Masquin для посуды,336,,https://www.detmir.ru/product/index/id/3793555/
3885599,Соль для всех видов посудомоечных машин Rossinka специальная 1000г,139,,https://www.detmir.ru/product/index/id/3885599/
3885601,Гель для всех видов посудомоечных машин Rossinka lemon 1000мл,649,,https://www.detmir.ru/product/index/id/3885601/
3885628,Гель для посуды Rossinka лимон с колпачком push-pull 500мл,199,,https://www.detmir.ru/product/index/id/3885628/
3885629,Гель для посуды Rossinka алоэ-чайное дерево 500мл,199,,https://www.detmir.ru/product/index/id/3885629/
3885631,Гель для посуды Rossinka грейпфрут-цветы апельсина 500мл,199,,https://www.detmir.ru/product/index/id/3885631/
3885632,Гель для посуды Rossinka ромашка 500мл,199,,https://www.detmir.ru/product/index/id/3885632/
391011,"Экологичное средство для мытья посуды, овощей и фруктов BioMio (с эфирным маслом вербены и экстрактом хлопка) 450 мл",219,149,https://www.detmir.ru/product/index/id/391011/
4056058,Средство для мытья посуды Солнце и луна ECO без запаха 0+ флакон/флиптоп 500мл,302,259,https://www.detmir.ru/product/index/id/4056058/
4289700,Гель для мытья посуды ECOZAVR фруктов и овощей с антибактериальным эффектом Зеленое яблоко 500мл,220,187,https://www.detmir.ru/product/index/id/4289700/
4333850,Гель для мытья посуды MeloMama биоразлагаемый Луговой романс 500мл,320,235,https://www.detmir.ru/product/index/id/4333850/
4389756,Средство для мытья посуды LV Dishwashing liquid 500 мл,484,,https://www.detmir.ru/product/index/id/4389756/
4455718,Ополаскиватель Effect Вита 204 для посудомоечных машинах для жесткой воды 5л,2819,,https://www.detmir.ru/product/index/id/4455718/
4484878,Гель для посуды Zelenka с экстрактом алоэ 0.5л,195,,https://www.detmir.ru/product/index/id/4484878/
4577310,Средство для мытья фруктов Garden Eco 500мл 46 50056 49243 2,229,,https://www.detmir.ru/product/index/id/4577310/
4595060,Гель-бальзам для мытья посуды Synergetic Розмарин-Листья смородины 3.5л,1299,,https://www.detmir.ru/product/index/id/4595060/
4674590,Средство для мытья посуды Flexfresh фруктов игрушек гель антибактериальный с ароматом белого чая 3л,595,,https://www.detmir.ru/product/index/id/4674590/
4674591,Средство для мытья посуды Flexfresh фруктов и игрушек гель антибактериальный с ароматом белого чая с дозатором 3л,650,599,https://www.detmir.ru/product/index/id/4674591/
4681987,Средство для мытья посуды CJ LION Charmgreen овощей и фруктов зеленый чай 800 г,629,352,https://www.detmir.ru/product/index/id/4681987/
4681988,Средство для мытья посуды CJ LION Charmgreen pump овощей и фруктов древесный уголь 1 кг,786,503,https://www.detmir.ru/product/index/id/4681988/
4692756,Средство для мытья посуды CJ LION Charmgreen овощей и фруктов Японский абрикос 300 г,396,277,https://www.detmir.ru/product/index/id/4692756/
4692757,Средство для мытья посуды CJ LION Charmgreen овощей и фруктов зеленый чай 300 мл,427,298,https://www.detmir.ru/product/index/id/4692757/
4784033,Ерш для мытья посуды Sima-Land универсальный 33 см,421,189,https://www.detmir.ru/product/index/id/4784033/
4784036,Ерш для мытья посуды Доляна с микрофиброй искуственная щетина,285,85,https://www.detmir.ru/product/index/id/4784036/
4784037,Ерш абразивный Доляна для посуды Радуга,449,179,https://www.detmir.ru/product/index/id/4784037/
6791,Ершик Dr Brown's для чистки бутылочки,605,,https://www.detmir.ru/product/index/id/6791/
2245431,Ёрш для мытья посуды Lubby с губкой в ассортименте,105,49,https://www.detmir.ru/product/index/id/2245431/
3280405,Набор ершиков для бутылочек и сосок Lubby 2шт 4541,225,,https://www.detmir.ru/product/index/id/3280405/
4148621,Средство моющее Synergetic Optima универсальное 5 л,249,,https://www.detmir.ru/product/index/id/4148621/
4003322,Средство для мытья посуды Лайма 5л концентрат Антибактериальное,813,455,https://www.detmir.ru/product/index/id/4003322/
3839429,Ершик ПОМА зеленый Пома,363,326,https://www.detmir.ru/product/index/id/3839429/
3856006,Таблетки для мытья посуды Jundo Active Oxygen 3в1 200 шт,4530,2083,https://www.detmir.ru/product/index/id/3856006/
3483524,Средство для мытья посуды Fairy PureClean 450мл,199,175,https://www.detmir.ru/product/index/id/3483524/
3546261,Ершик для бутылочек KUNDER силиконовый,418,342,https://www.detmir.ru/product/index/id/3546261/
3112455,Щетка для бутылочки Dr Brown's Easy-Clean AC040,529,,https://www.detmir.ru/product/index/id/3112455/
3596868,Средство для мытья посуды Garden Eco цитрус эко-гель концентрат 2шт по 500 мл,219,175,https://www.detmir.ru/product/index/id/3596868/
4880901,Гель для мытья посуды YokoSun Яблоко 1л,469,329,https://www.detmir.ru/product/index/id/4880901/
3583995,Жидкость для мытья посуды Garden Eco алое вера эко-гель концентрат 2шт по 500 мл,219,175,https://www.detmir.ru/product/index/id/3583995/
3597118,Набор ершиков Мультидом для мытья детских бутылочек 2 в 1 с губкой 2шт Мультидом,248,,https://www.detmir.ru/product/index/id/3597118/
3639237,Таблетки Frau Schmidt для посудомоечной машины 100 шт,1490,894,https://www.detmir.ru/product/index/id/3639237/
3583707,Таблетки Kiilto для посудомоечной машины All in 1- 12 шт,395,280,https://www.detmir.ru/product/index/id/3583707/
3112458,Ершик для бутылочки Dr Brown's Делюкс 702,879,,https://www.detmir.ru/product/index/id/3112458/
4424701,Гель для мытья посуды WONDER Lab нейтральный 1л,395,355,https://www.detmir.ru/product/index/id/4424701/
3217543,Ершик для бутылочки Dr Brown's 2шт Синий AC183,1109,885,https://www.detmir.ru/product/index/id/3217543/
3470058,Гель для мытья посуды овощей и фруктов WONDER Lab Яблочный цвет 1л,255,99,https://www.detmir.ru/product/index/id/3470058/
228431,Моющее средство Babyline Натуральное детское для посуды овощей и фруктов с дозатором 600 мл.,359,,https://www.detmir.ru/product/index/id/228431/
3091891,Средство для мытья бутылочек игрушек посуды Bebble 500мл 303140,259,,https://www.detmir.ru/product/index/id/3091891/
1957191,Ершик для бутылочки Dr Brown's Розовый AC026,605,,https://www.detmir.ru/product/index/id/1957191/
3176142,Жидкость для мытья посуды Arau baby 500мл 25819,799,559,https://www.detmir.ru/product/index/id/3176142/
4568911,Ершик для сосок Пома синий,208,187,https://www.detmir.ru/product/index/id/4568911/
3672436,Cредство для мытья посуды Palmia Espressiva с ароматом красных маков и граната 5 л,1385,817,https://www.detmir.ru/product/index/id/3672436/
3776002,Таблетки GraSS Colorit 5в1 для посудомоечной машины 16 шт,652,430,https://www.detmir.ru/product/index/id/3776002/
3665405,Средство для мытья детской посуды Molecola экологичное 0.5л,159,,https://www.detmir.ru/product/index/id/3665405/
3604483,Средство для посуды ATTITUDE Citrus Гель,815,,https://www.detmir.ru/product/index/id/3604483/
3950436,Набор ершиков KUNDER для мытья бутылочек силиконовые бирюзовые,699,594,https://www.detmir.ru/product/index/id/3950436/
3597115,Набор губок-ершиков Мультидом для мытья бутылочек и соски 2 шт,318,,https://www.detmir.ru/product/index/id/3597115/
3473563,Ополаскиватель Top House для посудомоечных машин 1 л,590,401,https://www.detmir.ru/product/index/id/3473563/
3901659,Средство моющее SYNERGETIC универсальное Optima 5 л Synergetic,249,,https://www.detmir.ru/product/index/id/3901659/
3470059,Гель для мытья посуды овощей и фруктов WONDER Lab Жасмин и морская соль 1л,255,99,https://www.detmir.ru/product/index/id/3470059/
4299665,Ершик Uviton для мытья бутылочек 0073 голубой,199,,https://www.detmir.ru/product/index/id/4299665/
3865143,Гель для мытья посуды Molecola Калифорнийский ананас экологичное 500 мл,294,173,https://www.detmir.ru/product/index/id/3865143/
3473490,Бальзам для мытья посуды Nordland Кокос-киви 500 мл,489,308,https://www.detmir.ru/product/index/id/3473490/
4783931,Щетка-ёрш Доляна для чистки посуды щетина кокос деревянная ручка,289,69,https://www.detmir.ru/product/index/id/4783931/
2267731,"Средство посудомоечных машин Synergetic автомат, 1000мл",419,,https://www.detmir.ru/product/index/id/2267731/
3202950,Средство для мытья посуды овощей и фруктов LION Chamgreen Японский абрикос запасной блок 960мл,379,,https://www.detmir.ru/product/index/id/3202950/
3633591,Соль для посудомоечной машины Frau Schmidt 2.2 кг,399,295,https://www.detmir.ru/product/index/id/3633591/
3473536,Соль Typhoon для посудомоечных машин 1 кг,290,200,https://www.detmir.ru/product/index/id/3473536/
4288086,Средство для мытья посуды LION Chamgreen зеленый чай флакон 480 мл,441,220,https://www.detmir.ru/product/index/id/4288086/
4299666,Ершик Uviton для мытья бутылочек 0073 желтый,200,,https://www.detmir.ru/product/index/id/4299666/
3137679,Средство моющее Я РОДИЛСЯ универсальное 900г 1137-3,179,69,https://www.detmir.ru/product/index/id/3137679/
4784034,Ерш для мытья посуды Sima-Land набор 2 шт,226,70,https://www.detmir.ru/product/index/id/4784034/
3470054,Гель для мытья посуды овощей и фруктов WONDER Lab Яблочный цвет 480мл,319,,https://www.detmir.ru/product/index/id/3470054/
3470060,Пена для мытья овощей и фруктов WONDER Lab 240мл,255,99,https://www.detmir.ru/product/index/id/3470060/
4097747,Очиститель Frau Schmidt для стиральных и посудомоечных машин 2 таблетки,199,131,https://www.detmir.ru/product/index/id/4097747/
4784031,Ерш для мытья посуды Sima-Land набор 2 шт,221,68,https://www.detmir.ru/product/index/id/4784031/
1180441,Набор ершиков Мир Детства для бутылочек и сосок,91,25,https://www.detmir.ru/product/index/id/1180441/
156462,Ершик для бутылочек Nuk в ассортименте 10256279,695,,https://www.detmir.ru/product/index/id/156462/
1700421,Набор ершиков Chicco для бутылок и соски,639,319,https://www.detmir.ru/product/index/id/1700421/
1782481,Ершик для бутылочек Nuk с губкой 10256278,649,,https://www.detmir.ru/product/index/id/1782481/
1801331,Натуральное моющее средство Baby line The Original для посуды овощей и фруктов 500мл,209,99,https://www.detmir.ru/product/index/id/1801331/
2004411,Ершик Мир Детства для бутылочек в ассортименте,109,75,https://www.detmir.ru/product/index/id/2004411/
217362,Средство для мытья бутылочек и овощей Pigeon 700 мл сменный блок,659,329,https://www.detmir.ru/product/index/id/217362/
217372,Средство для мытья бутылочек и овощей Pigeon 800 мл,1029,205,https://www.detmir.ru/product/index/id/217372/
2229801,Гель для мытья детской посуды Я РОДИЛСЯ 500 гр,99,69,https://www.detmir.ru/product/index/id/2229801/
2229811,Жидкость для мытья посуды Я РОДИЛСЯ и овощей 500гр,69,29,https://www.detmir.ru/product/index/id/2229811/
2229821,Гель для детской посуды Я РОДИЛСЯ 1 л,179,89,https://www.detmir.ru/product/index/id/2229821/
22451,Универсальное средство для мытья детской посуды Наша Мама 500 мл,185,89,https://www.detmir.ru/product/index/id/22451/
2245421,Ёрш для мытья посуды Lubby с присоской,169,,https://www.detmir.ru/product/index/id/2245421/
2250791,Жидкость для посуды Я РОДИЛСЯ универсальная 1 л,179,89,https://www.detmir.ru/product/index/id/2250791/
2267711,Средство для мытья посуды Synergetic 1000мл,379,,https://www.detmir.ru/product/index/id/2267711/
2267721,"Средство для мытья посуды Synergetic алоэ, 1000мл",379,,https://www.detmir.ru/product/index/id/2267721/
2267741,"Средство для мытья посуды Synergetic яблоко,1000мл",379,,https://www.detmir.ru/product/index/id/2267741/
2267751,Средство для мытья посуды Synergetic 5000мл,1379,,https://www.detmir.ru/product/index/id/2267751/
2317911,Гель для мытья  посуды Babyline детский 250мл,105,49,https://www.detmir.ru/product/index/id/2317911/
2498211,Средство для мытья овощей фруктов детской посуды LION Chamgreen Гранат 470мл,185,,https://www.detmir.ru/product/index/id/2498211/
2498221,"Средство для мытья CJ LION овощей, фруктов, дет.посуды Chamgreen Айва 470мл",185,,https://www.detmir.ru/product/index/id/2498221/
2498231,"Средство для мытья CJ LION овощей, фруктов, дет.посуды Chamgreen Гранат 900 мл сменный блок",279,,https://www.detmir.ru/product/index/id/2498231/
2498241,Средство для мытья овощей фруктов детской посуды LION Chamgreen Гранат запасной блок 900мл,279,,https://www.detmir.ru/product/index/id/2498241/
2672281,Гель  для мытья Palmia посуды овощей и фруктов  0.5л,129,89,https://www.detmir.ru/product/index/id/2672281/
2672291,Гель  для мытья Palmia детской посуды 0.5л,159,109,https://www.detmir.ru/product/index/id/2672291/
2672301,Гель  для мытья Palmia посуды овощей и фруктов 1л,155,105,https://www.detmir.ru/product/index/id/2672301/
2672311,Гель  для мытья Palmia детской посуды 1л,179,119,https://www.detmir.ru/product/index/id/2672311/
2696801,Набор BabyGo для бутылочек и сосок 2 в 1 (BD-19051),69,19,https://www.detmir.ru/product/index/id/2696801/
2696821,Ершик 2в1 BabyGo для бутылочек и сосок BD-19097,89,5,https://www.detmir.ru/product/index/id/2696821/
2806091,Cредство для мытья посуды лимон и мята Sanita 510г,65,29,https://www.detmir.ru/product/index/id/2806091/
2806101,Средство для мытья посуды Sanita облепиха и мед 510г,69,29,https://www.detmir.ru/product/index/id/2806101/
2839851,Ёрш Lubby для мытья бутылочек и сосок 2 шт.,165,,https://www.detmir.ru/product/index/id/2839851/
2867941,"Средство для мытья Frosch детской посуды 0,5 л",195,155,https://www.detmir.ru/product/index/id/2867941/
2887051,Ершик для бутылочек BabyGo BD-19051,119,9,https://www.detmir.ru/product/index/id/2887051/
3084401,Щётка Tommee tippee для мытья бутылочек и сосок Голубая,299,149,https://www.detmir.ru/product/index/id/3084401/
3084402,Щётка Tommee tippee для мытья бутылочек и сосок Розовая,299,149,https://www.detmir.ru/product/index/id/3084402/
3102604,Набор Kidsme трубочка+ершик 160324,389,259,https://www.detmir.ru/product/index/id/3102604/
3108116,Трубочка к поильнику Lubby сменная +ершик i-Brush 15842,109,79,https://www.detmir.ru/product/index/id/3108116/
