id,title,price,promo_price,url
3125657,Гель для мытья посуды овощей и фруктов Palmia Sensitiva 5л 4640015110613,599,419,https://www.detmir.ru/product/index/id/3125657/
3125658,Гель для мытья посуды Palmia Bambini 5л 4640015110620,669,465,https://www.detmir.ru/product/index/id/3125658/
3135412,Средство для мытья пола Glorix Свежесть Атлантики 500мл 67106787,109,,https://www.detmir.ru/product/index/id/3135412/
3135413,Средство для мытья пола Glorix Лимонная энергия 500мл 67107678,109,,https://www.detmir.ru/product/index/id/3135413/
3137677,Средство для мытья детской посуды Я РОДИЛСЯ жидкое моющее 900г 1135-3,179,69,https://www.detmir.ru/product/index/id/3137677/
3137678,Средство для мытья детской посуды Я РОДИЛСЯ жидкое моющее 450г 1134-3,99,49,https://www.detmir.ru/product/index/id/3137678/
3143783,Гель-концентрат для мытья посуды Hanbok Айва и лимонник 500мл,205,19,https://www.detmir.ru/product/index/id/3143783/
3176143,Жидкость для мытья посуды Arau baby сменный картридж 450мл,509,355,https://www.detmir.ru/product/index/id/3176143/
3176159,Бальзам для мытья посуды Organic People Green Био aloе 500мл,135,79,https://www.detmir.ru/product/index/id/3176159/
3194024,Ершик-щетка Мир Детства 2в1 в ассортименте 19559,219,65,https://www.detmir.ru/product/index/id/3194024/
3195540,Средство моющее Мир Детства для детских принадлежностей универсальное 500мл,175,,https://www.detmir.ru/product/index/id/3195540/
3280404,Ершик для сосок Lubby 16895,109,,https://www.detmir.ru/product/index/id/3280404/
3335844,Средство для мытья посуды BioMio 315мл,159,55,https://www.detmir.ru/product/index/id/3335844/
3430169,Гель для мытья посуды Mein Kleines 500мл,279,228,https://www.detmir.ru/product/index/id/3430169/
3443013,Гель для мытья посуды INSEENSE овощей и фруктов 1000мл,500,380,https://www.detmir.ru/product/index/id/3443013/
3470052,Гель для мытья посуды овощей и фруктов WONDER Lab 480мл,175,,https://www.detmir.ru/product/index/id/3470052/
3470053,Гель для мытья посуды овощей и фруктов WONDER Lab Сливочные фрукты 480мл,175,,https://www.detmir.ru/product/index/id/3470053/
3470055,Гель для мытья посуды овощей и фруктов WONDER Lab Жасмин и морская соль 480мл,175,69,https://www.detmir.ru/product/index/id/3470055/
3470056,Гель для мытья посуды овощей и фруктов WONDER Lab 1л,255,99,https://www.detmir.ru/product/index/id/3470056/
3470057,Гель для мытья посуды овощей и фруктов WONDER Lab Сливочные фрукты 1л,255,99,https://www.detmir.ru/product/index/id/3470057/
3473473,Бальзам Baby Speci для мытья детской посуды Земляника со сливками 500 мл,469,300,https://www.detmir.ru/product/index/id/3473473/
3473492,Бальзам для мытья посуды Nordland Апельсин-ваниль 500 мл,489,308,https://www.detmir.ru/product/index/id/3473492/
3473496,Таблетки Nordland для посудомоечных машин 30 шт,749,501,https://www.detmir.ru/product/index/id/3473496/
3473565,Cоль Top House для посудомоечных машин 1500 г,460,299,https://www.detmir.ru/product/index/id/3473565/
3487570,Ополаскиватель для ПММ Postiron 2л Postiron,651,,https://www.detmir.ru/product/index/id/3487570/
3487588,Средство для мытья посуды Postiron 2л Postiron,545,517,https://www.detmir.ru/product/index/id/3487588/
3487589,Средство для мытья посуды Postiron кокос 0.65 л Postiron,279,,https://www.detmir.ru/product/index/id/3487589/
3489836,Жидкость для мытья посуды ARAU наполнитель 380мл 32066,369,255,https://www.detmir.ru/product/index/id/3489836/
3496829,Спрей для мытья посуды Химола Фермент-15,409,,https://www.detmir.ru/product/index/id/3496829/
3507491,Таблетки Bioretto для посудомоечной машины mini 28,359,,https://www.detmir.ru/product/index/id/3507491/
3507492,Таблетки Bioretto для посудомоечной машины 150 штук,2029,,https://www.detmir.ru/product/index/id/3507492/
3507493,Таблетки Bioretto для посудомоечных машин 56 штук mini,659,,https://www.detmir.ru/product/index/id/3507493/
3507494,Таблетки Bioretto для посудомоечных машин 32,609,,https://www.detmir.ru/product/index/id/3507494/
3507495,Таблетки Bioretto для посудомоечной машины 65 шт,1019,,https://www.detmir.ru/product/index/id/3507495/
3507496,Соль для посудомоечной машины Bioretto 2кг,329,,https://www.detmir.ru/product/index/id/3507496/
3507497,Порошок Bioretto для посудомоечной машины 1800 грамм,1319,,https://www.detmir.ru/product/index/id/3507497/
3507498,Ополаскиватель Bioretto для посудомоечной машины 1 литр,319,,https://www.detmir.ru/product/index/id/3507498/
3507500,Средство Bioretto для уборки кухни 650мл Bioretto,365,,https://www.detmir.ru/product/index/id/3507500/
3507503,Ополаскиватель Bioretto для посудомоечной машины 4 литра,869,,https://www.detmir.ru/product/index/id/3507503/
3537996,Очиститель накипи TOPPERR для стиральных и посудомоечных машин 50г 3226,215,172,https://www.detmir.ru/product/index/id/3537996/
3538025,Обезжиривающее средство TOPPERR для стиральных и посудомоечных машин 3220,369,295,https://www.detmir.ru/product/index/id/3538025/
3543241,Экспресс-очиститель накипи TOPPERR для стиральных и посудомоечных машин 3203,409,327,https://www.detmir.ru/product/index/id/3543241/
3543244,Ополаскиватель TOPPERR для посудомоечных машин 500мл 3301,359,290,https://www.detmir.ru/product/index/id/3543244/
3543246,Стартовый набор TOPPERR для посудомоечных машин 10в1 3304,1145,916,https://www.detmir.ru/product/index/id/3543246/
3543247,Таблетки TOPPERR для посудомоечных машин 10в1 60шт 3306,1399,1119,https://www.detmir.ru/product/index/id/3543247/
3543248,Таблетки TOPPERR для посудомоечных машин 120шт 3310,2525,2020,https://www.detmir.ru/product/index/id/3543248/
3543316,Таблетки TOPPERR для посудомоечных машин 22шт 3321,499,399,https://www.detmir.ru/product/index/id/3543316/
3543317,Таблетки TOPPERR для посудомоечных машин 160шт 3322,3329,2663,https://www.detmir.ru/product/index/id/3543317/
3543320,Соль TOPPERR для посудомоечных машин 1.5кг 3309,389,311,https://www.detmir.ru/product/index/id/3543320/
3543321,Соль TOPPERR таблетированная для посудомоечных машин 750г 3318,199,139,https://www.detmir.ru/product/index/id/3543321/
3543322,Соль TOPPERR для посудомоечных машин 750г 3317,199,,https://www.detmir.ru/product/index/id/3543322/
3543323,Очиститель TOPPERR посудомоечных машин таблетированный 2шт 3324,199,143,https://www.detmir.ru/product/index/id/3543323/
3543327,Средство TOPPERR для удаления накипи в стиральных и посудомоечных машинах 500мл 3032,359,287,https://www.detmir.ru/product/index/id/3543327/
3543328,Таблетки TOPPERR от накипи для чайников и кофеварок 2шт 3033,199,99,https://www.detmir.ru/product/index/id/3543328/
3543329,Таблетки TOPPERR от накипи для чайников и кофеварок 10шт 3043,299,239,https://www.detmir.ru/product/index/id/3543329/
3543330,Таблетки TOPPERR от накипи для чайников и кофеварок 16шт 3044,469,379,https://www.detmir.ru/product/index/id/3543330/
3543920,Средство моющее TOPPERR для посудомоечных машин порошковое 1.8кг 3319,459,367,https://www.detmir.ru/product/index/id/3543920/
3565849,Ершик Bebe Confort Для сосок и бутылочек Голубой,539,,https://www.detmir.ru/product/index/id/3565849/
3575664,Средство для мытья посуды Fourmi Verte натуральное 500мл,319,,https://www.detmir.ru/product/index/id/3575664/
3583708,Таблетки Kiilto для посудомоечной машины All in 1 - 42 шт,1296,855,https://www.detmir.ru/product/index/id/3583708/
3583709,Таблетки Kiilto для посудомоечной машины All in 1- 68 шт,1960,1254,https://www.detmir.ru/product/index/id/3583709/
3585950,Средство для мытья посуды BioMio с эфирным маслом Лаванды/экстрактом хлопка/ионами серебра 450 мл,239,148,https://www.detmir.ru/product/index/id/3585950/
3585951,Средство для мытья посуды BioMio с эфирным маслом Мяты/экстрактом хлопка/ионами серебра 450 мл,229,148,https://www.detmir.ru/product/index/id/3585951/
3585958,Таблетки BioMio для посудомоечной машины Biototal 7в1 с эфирным маслом эвкалипта,319,239,https://www.detmir.ru/product/index/id/3585958/
3594824,Средство для посуды ATTITUDE без запаха Гель,838,,https://www.detmir.ru/product/index/id/3594824/
3603207,Набор DUTYBOX Пенка для для мытья посуды овощей и фруктов Dishes 1л,255,,https://www.detmir.ru/product/index/id/3603207/
3604752,Ароматизатор TOPPERR для посудомоечных машин и запасной блок 3323 TOPPERR,235,188,https://www.detmir.ru/product/index/id/3604752/
3610444,Средство для мытья посуды DUTYBOX Dishes 2шт по 50мл,199,,https://www.detmir.ru/product/index/id/3610444/
3612641,Средство для мытья посуды Сotico Baby 500 мл,199,,https://www.detmir.ru/product/index/id/3612641/
3639238,Таблетки Frau Schmidt для посудомоечной машины 140 шт,1989,1193,https://www.detmir.ru/product/index/id/3639238/
3639239,Таблетки Frau Schmidt для посудомоечной машины 150 шт,1989,1213,https://www.detmir.ru/product/index/id/3639239/
3639240,Таблетки Frau Schmidt для посудомоечной машины 130 шт,1989,1292,https://www.detmir.ru/product/index/id/3639240/
3639241,Таблетки Frau Schmidt для посудомоечной машины 120 шт,1989,1193,https://www.detmir.ru/product/index/id/3639241/
3655214,Гель для посудомоечных машин Celesta all in 1 800 мл,419,,https://www.detmir.ru/product/index/id/3655214/
3655260,Набор ершиков Bebe Confort для мытья сосок и бутылочек с широким горлом 30167200 Bebe Confort,437,305,https://www.detmir.ru/product/index/id/3655260/
3665684,Средство для мытья посуды Palmia Automatica для посудомоечных машин 1 л,856,513,https://www.detmir.ru/product/index/id/3665684/
3665687,Гель для мытья посуды Clean Home универсальный 1 л,453,267,https://www.detmir.ru/product/index/id/3665687/
3665688,Гель для посудомоечных машин Clean Home профессиональный 1 л,595,362,https://www.detmir.ru/product/index/id/3665688/
3665690,Гель для мытья посуды Clean Home универсальный 1 л,597,358,https://www.detmir.ru/product/index/id/3665690/
3665709,Соль для посудомоечных машин Molecola таблетированная 2000гр,474,279,https://www.detmir.ru/product/index/id/3665709/
3665710,Гель для мытья посуды Jundo Green tea with mint и детских принадлежностей 1 л,792,483,https://www.detmir.ru/product/index/id/3665710/
3665711,Гель для мытья посуды Jundo Juicy Lemon для детских принадлежностей 1 л,788,409,https://www.detmir.ru/product/index/id/3665711/
3665712,Гель для мытья посуды Jundo Sakura для детских принадлежностей 1 л,792,411,https://www.detmir.ru/product/index/id/3665712/
3665729,Гель для мытья посуды Clean Home универсальный 3 л,977,576,https://www.detmir.ru/product/index/id/3665729/
3672357,Гель для мытья посуды Clean Home и кухни Антибактериальный эффект 490 гр,447,263,https://www.detmir.ru/product/index/id/3672357/
3672366,Гель для мытья посуды Jundo Juicy Lemon и для детских принадлежностей 4 л,1969,905,https://www.detmir.ru/product/index/id/3672366/
3672367,Гель для мытья посуды Jundo Sakura и для детских принадлежностей 4 л,1932,888,https://www.detmir.ru/product/index/id/3672367/
3672376,Гель для мытья посуды Jundo Green tea with mint и для детских принадлежностей 4 л,1982,911,https://www.detmir.ru/product/index/id/3672376/
3672380,Таблетки для мытья посуды Molecola в посудомоечных машинах экологичные 30 шт,561,330,https://www.detmir.ru/product/index/id/3672380/
3672391,Ополаскиватель для посуды Palmia Cristalica Proff в посудомоечных машинах 5 л,3145,1541,https://www.detmir.ru/product/index/id/3672391/
3672406,Таблетки для мытья посуды Clean Home в посудомоечных машинах 30 шт,866,510,https://www.detmir.ru/product/index/id/3672406/
3672435,Cредство для мытья посуды Palmia Fiorenta с ароматом ежевики и васильков 5 л,1385,817,https://www.detmir.ru/product/index/id/3672435/
3672437,Cредство для мытья посуды Palmia Tropica с ароматом персика дыни и фейхоа 5 л,1385,817,https://www.detmir.ru/product/index/id/3672437/
3679217,Cредство для мытья посуды Palmia Aromatica c ароматом зеленого чая и жасмина 5 л,1385,817,https://www.detmir.ru/product/index/id/3679217/
3690075,Средство для мытья посуды Synergetic в посудомоечной машине 5 л,699,,https://www.detmir.ru/product/index/id/3690075/
3690076,Средство для мытья посуды Synergetic Pro 5 л,999,,https://www.detmir.ru/product/index/id/3690076/
3690110,Средство Synergetic ополаскивающее для посудомоечных машин Pro 5 л,1099,,https://www.detmir.ru/product/index/id/3690110/
3702034,Гель для мытья посуды Ушастый нянь детский,262,,https://www.detmir.ru/product/index/id/3702034/
3713323,Гель для мытья посуды Jundo Sakura с гиалуроновой кислотой 800 мл х2шт,597,,https://www.detmir.ru/product/index/id/3713323/
3725066,Таблетки для мытья посуды Ушастый нянь 06450,579,,https://www.detmir.ru/product/index/id/3725066/
3733600,Гель для мытья посуды Невская косметика и принадлежностей Детский,199,129,https://www.detmir.ru/product/index/id/3733600/
3733604,Гель для мытья посуды Ушастый нянь детский,199,165,https://www.detmir.ru/product/index/id/3733604/
3733606,Гель для мытья посуды Ушастый нянь детский,262,,https://www.detmir.ru/product/index/id/3733606/
3733775,Дезинфицирующее средство Medlex для посуды 500 мл Medlex,199,,https://www.detmir.ru/product/index/id/3733775/
3733780,Моющее средство Medlex для посуды 500 мл Medlex,199,,https://www.detmir.ru/product/index/id/3733780/
3763278,Сушилка для посуды Brabantia Sink Side,12890,,https://www.detmir.ru/product/index/id/3763278/
3763281,Коврик для сушки посуды Brabantia Sink Side силиконовый Brabantia,6879,,https://www.detmir.ru/product/index/id/3763281/
3763317,Сушилка для посуды Brabantia Sink Side Brabantia,21490,,https://www.detmir.ru/product/index/id/3763317/
3765850,Ёршик Крошка Я для бутылочек Крошка Я,352,,https://www.detmir.ru/product/index/id/3765850/
3766238,Гель для мытья посуды Jundo Green tea with Mint и детских принадлежностей 800мл,400,,https://www.detmir.ru/product/index/id/3766238/
3766240,Гель для мытья посуды Jundo Sakura и детских принадлежностей 800мл,400,,https://www.detmir.ru/product/index/id/3766240/
3769509,Коврик для сушки посуды Brabantia Sink Side из микрофибры Brabantia,1719,,https://www.detmir.ru/product/index/id/3769509/
3769940,Ершик для бутылочек и сосок Mum and Baby Которусалка Mum and Baby,352,,https://www.detmir.ru/product/index/id/3769940/
3769941,Ершик для бутылочек и сосок Mum and Baby Лама Mum and Baby,352,,https://www.detmir.ru/product/index/id/3769941/
3769942,Ершик для бутылочек и сосок Mum and Baby Пёсики Mum and Baby,352,,https://www.detmir.ru/product/index/id/3769942/
3769943,Ершик для бутылочек и сосок Mum and Baby Леопард Mum and Baby,352,,https://www.detmir.ru/product/index/id/3769943/
3769944,Ершик для бутылочек и сосок Mum and Baby Пингвин Mum and Baby,352,,https://www.detmir.ru/product/index/id/3769944/
3772869,Ёршик Крошка Я по уходу за детскими бутылочками и сосками Крошка Я,352,,https://www.detmir.ru/product/index/id/3772869/
3772952,Ёршик Крошка Я по уходу за детскими бутылочками Крошка Я,199,,https://www.detmir.ru/product/index/id/3772952/
3772954,Ёршик Крошка Я по уходу за детскими бутылочками Крошка Я,199,,https://www.detmir.ru/product/index/id/3772954/
3775920,Средство для мытья посуды GraSS Viva c дозатором 1 л,323,164,https://www.detmir.ru/product/index/id/3775920/
3775998,Средство для мытья посуды GraSS Velly Premium лайм и мята 1л,307,184,https://www.detmir.ru/product/index/id/3775998/
3776006,Таблетки GraSS Colorit 5в1 для посудомоечной машины 35 шт,1143,800,https://www.detmir.ru/product/index/id/3776006/
3785163,Ёршик Крошка Я по уходу за детскими бутылочками Крошка Я,352,,https://www.detmir.ru/product/index/id/3785163/
3785164,Ершик Крошка Я для бутылочек и сосок желтый Крошка Я,199,,https://www.detmir.ru/product/index/id/3785164/
3789068,Средство для мытья посуды Palmia Aromatica с ароматом жасмина и зеленого чая 500 мл,223,127,https://www.detmir.ru/product/index/id/3789068/
3789135,Средство для мытья посуды Palmia Espressiva c ароматом спелого граната и красных маков 500 мл,217,128,https://www.detmir.ru/product/index/id/3789135/
3789136,Средство для мытья посуды Palmia Fiorenta с ароматом ежевики и васильков 500 мл,223,127,https://www.detmir.ru/product/index/id/3789136/
3789137,Средство для мытья посуды Palmia Sensitiva также для овощей и фруктов гипоаллергенное 450 мл,216,92,https://www.detmir.ru/product/index/id/3789137/
3789138,Средство для мытья посуды Palmia Tropica с ароматом тропических фруктов 500 мл,223,127,https://www.detmir.ru/product/index/id/3789138/
3789139,Гель для мытья посуды Palmia Bambini детской на основе пищевой соды 450 мл,216,97,https://www.detmir.ru/product/index/id/3789139/
3794901,Средство для мытья посуды fito косметик Натуральное Мыльные стружки серии Народные рецепты 490мл,367,183,https://www.detmir.ru/product/index/id/3794901/
3794902,Гель-концентрат fito косметик Натуральный для мытья посуды Цитрусовый микс серии Народные рецепты 490мл,394,197,https://www.detmir.ru/product/index/id/3794902/
3794903,Средство для мытья посуды fito косметик Натуральное Жидкая горчица серии Народные рецепты 490мл,367,183,https://www.detmir.ru/product/index/id/3794903/
3798672,Порошок levrana для посудомоечной машины усиленная формула 1000 гр,785,549,https://www.detmir.ru/product/index/id/3798672/
3806248,Гель для мытья посуды Freshbubble Мята и Лимон 1л,357,249,https://www.detmir.ru/product/index/id/3806248/
3806249,Гель для мытья посуды Freshbubble Цитрусовая свежесть 1 л,357,249,https://www.detmir.ru/product/index/id/3806249/
3806250,Гель для мытья посуды Freshbubble без аромата 1л,357,249,https://www.detmir.ru/product/index/id/3806250/
3806251,Гель для мытья посуды Freshbubble Хвойный лес 1 л,357,249,https://www.detmir.ru/product/index/id/3806251/
3806252,Гель для мытья посуды Freshbubble Прованские травы 1 л,357,249,https://www.detmir.ru/product/index/id/3806252/
3806595,Салфетка для уборки Master fresh супервпитывающие 3 шт вискоза,199,99,https://www.detmir.ru/product/index/id/3806595/
3806621,Губки для посуды Master fresh 2 шт,199,119,https://www.detmir.ru/product/index/id/3806621/
3806640,Таблетки Master fresh для посудомоечной машины 28 шт,482,409,https://www.detmir.ru/product/index/id/3806640/
3806642,Таблетки Master fresh для посудомоечной машины 60шт,1053,737,https://www.detmir.ru/product/index/id/3806642/
3806643,Таблетки Master fresh для посудомоечной машины есо 30 шт,653,522,https://www.detmir.ru/product/index/id/3806643/
3806645,Таблетки Master fresh для посудомоечной машины luxury 20 шт,365,292,https://www.detmir.ru/product/index/id/3806645/
3806662,Чистящее средство Master fresh антижир 500 мл,241,192,https://www.detmir.ru/product/index/id/3806662/
3806666,Чистящее средство Master fresh антижир 500 мл,199,159,https://www.detmir.ru/product/index/id/3806666/
3806677,Средство для мытья стекол Master fresh 500 мл лимон,199,139,https://www.detmir.ru/product/index/id/3806677/
3806679,Средство для мытья посуды Master fresh 500 мл,199,149,https://www.detmir.ru/product/index/id/3806679/
3829513,Средство для мытья посуды Vaily Sensitive для овощей и фруктов гипоаллергенное 500 мл Vaily,209,,https://www.detmir.ru/product/index/id/3829513/
3829514,Средство для мытья посуды Vaily Touch овощей и фруктов 500 мл Vaily,209,,https://www.detmir.ru/product/index/id/3829514/
3829516,Ополаскиватель Vaily для посудомоечной машины ЭКО 550 мл Vaily,199,,https://www.detmir.ru/product/index/id/3829516/
3839504,Соль Vaily для посудомоечной машины Эко 1 кг,205,,https://www.detmir.ru/product/index/id/3839504/
3839535,Таблетки Vaily для посудомоечной машины Эко 30 шт,575,460,https://www.detmir.ru/product/index/id/3839535/
3848775,Гель для мытья посуды UNICARE концентрированный «Сочный лимон» ПЭТ 5л,720,360,https://www.detmir.ru/product/index/id/3848775/
3848778,Гель для мытья посуды UNICARE концентрированный «Сочный лимон» ПВХ 5л,830,415,https://www.detmir.ru/product/index/id/3848778/
3848854,Гель для мытья посуды UNICARE концентрированный «Зеленый чай» ПЭТ 5л,720,360,https://www.detmir.ru/product/index/id/3848854/
3848855,Моющее средство MANUFACTOR универсальное нейтральное концентрат ПЭТ 5 л,491,245,https://www.detmir.ru/product/index/id/3848855/
