id,title,price,promo_price,url
3083452,Средство для мытья детской посуды сосок бутылочек и игрушек Synergetic биоразлагаемый 500 мл,229,109,https://www.detmir.ru/product/index/id/3083452/
1819141,Гель для мытья Meine Liebe овощей/фруктов/посуды и игрушек 485 мл NEW,269,169,https://www.detmir.ru/product/index/id/1819141/
1774351,Таблетки для посудомоечной машины BioMio 30 шт,849,499,https://www.detmir.ru/product/index/id/1774351/
3202875,Ершик для бутылочек и сосок BabyGo 2в1 с губкой Green BD19038,189,99,https://www.detmir.ru/product/index/id/3202875/
3117730,Ершик 2в1 BabyGo для бутылочек и сосок BD-19012,139,99,https://www.detmir.ru/product/index/id/3117730/
4595070,Таблетки для посудомоечных машин Synergetic 100шт 102100,2799,,https://www.detmir.ru/product/index/id/4595070/
1765011,Бальзам для мытья детской посуды и принадлежностей Умкa 500мл 870152,139,105,https://www.detmir.ru/product/index/id/1765011/
3335845,Средство для мытья посуды BioMio 750мл,379,289,https://www.detmir.ru/product/index/id/3335845/
226575,"Средство AQA baby для мытья бутылочек, сосок и детской посуды 500 мл",235,115,https://www.detmir.ru/product/index/id/226575/
3122629,Ершик для бутылочек BabyGo BD-19051,239,179,https://www.detmir.ru/product/index/id/3122629/
326021,"Экологичное средство для мытья посуды, овощей и фруктов BioMio BIO-CARE (без запаха, с экстрактом хлопка) 450 мл",229,189,https://www.detmir.ru/product/index/id/326021/
4594631,Гель-бальзам для мытья посуды Synergetic Pure 0% 1л 103115,459,,https://www.detmir.ru/product/index/id/4594631/
1021141,Ершик для бутылок и сосок Курносики в ассортименте 19537,179,159,https://www.detmir.ru/product/index/id/1021141/
3133564,Средство для мытья детской посуды сосок и бутылок Babyline 500мл,245,,https://www.detmir.ru/product/index/id/3133564/
3877347,Таблетки для посудомоечной машины BioMio Bio-Total Эвкалипт 100шт,2435,,https://www.detmir.ru/product/index/id/3877347/
2267681,"Средство для мытья посуды Synergetic алоэ, 500мл",229,129,https://www.detmir.ru/product/index/id/2267681/
2267691,"Средство для мытья посуды Synergetic яблоко, 500мл",229,129,https://www.detmir.ru/product/index/id/2267691/
3195580,Ершик для бутылочек Lubby мягкий 16894,245,169,https://www.detmir.ru/product/index/id/3195580/
3160943,Гель Fairy для мытья детской посуды 450 мл,219,175,https://www.detmir.ru/product/index/id/3160943/
326031,"Экологичное средство для мытья посуды, овощей и фруктов BioMio BIO-CARE (с эфирным маслом мандарина и экстрактом хлопка) 450 мл",249,169,https://www.detmir.ru/product/index/id/326031/
3310427,Средство для мытья посуды Fairy 650мл,299,269,https://www.detmir.ru/product/index/id/3310427/
217532,Щетка с губкой Pigeon для мытья детских бутылочек,905,649,https://www.detmir.ru/product/index/id/217532/
2867801,Таблетки для посудомоечных машин Babyline для всей семьи 50 шт.,705,,https://www.detmir.ru/product/index/id/2867801/
4094111,Гель для мытья детской посуды игрушек WONDER Lab нейтральный 550мл,275,205,https://www.detmir.ru/product/index/id/4094111/
22171,Щетка для бутылочек и сосок Philips Avent SCF145/06,709,495,https://www.detmir.ru/product/index/id/22171/
3810329,Средство для мытья посуды Pigeon Baby сменный блок 450мл,579,429,https://www.detmir.ru/product/index/id/3810329/
4675673,Набор ROXY-KIDS щеток и ершиков для мытья бутылочек и сосок,369,,https://www.detmir.ru/product/index/id/4675673/
3335843,Соль для посудомоечной машины BioMio 1000г,269,215,https://www.detmir.ru/product/index/id/3335843/
3810328,Средство для мытья посуды Pigeon Baby 500мл,739,549,https://www.detmir.ru/product/index/id/3810328/
3877349,Ополаскиватель для посудомоечной машины BioMio Bio-Rinse 750мл,369,345,https://www.detmir.ru/product/index/id/3877349/
3125018,Средство ля мытья детской посуды и принадлежностей Умкa 1л 870575,209,,https://www.detmir.ru/product/index/id/3125018/
3253399,Бальзам для мытья посуды BioMio Ромашка и Иланг-иланг 450мл,255,199,https://www.detmir.ru/product/index/id/3253399/
3237171,Губка для мытья посуды Умкa 2шт 870706,99,,https://www.detmir.ru/product/index/id/3237171/
217512,Щетка Pigeon для мытья силиконовых сосок,555,385,https://www.detmir.ru/product/index/id/217512/
4594629,Средство для мытья детской посуды сосок Synergetic 3.5л 103350,1099,,https://www.detmir.ru/product/index/id/4594629/
3533418,Средство для мытья посуды Helan органическое Bollicine детский 400 мл,950,902,https://www.detmir.ru/product/index/id/3533418/
3231623,Набор ершиков TUBIK 2шт 13957,255,209,https://www.detmir.ru/product/index/id/3231623/
3195542,Ершик для бутылочек Lubby с губкой 4543,219,139,https://www.detmir.ru/product/index/id/3195542/
4108123,Пена для мытья посуды BioMio Bio-Foam без запаха 350мл,349,259,https://www.detmir.ru/product/index/id/4108123/
3292739,Гель для мытья посуды Meine Liebe Сочный апельсин 500мл,189,165,https://www.detmir.ru/product/index/id/3292739/
4576151,Средство для мытья стекол зеркал и фарфора Meine Liebe с нашатырным спиртом и ароматом мяты 500мл,309,,https://www.detmir.ru/product/index/id/4576151/
3217542,Ершик для бутылочки Dr Brown's 2шт Розовый AC182,1109,885,https://www.detmir.ru/product/index/id/3217542/
4717069,Ершик силиконовый Floopsi для бутылочек и сосок 3шт.,899,434,https://www.detmir.ru/product/index/id/4717069/
2259881,Ершик Canpol Babies для бутылочек с губкой в ассортименте,359,225,https://www.detmir.ru/product/index/id/2259881/
2829261,Таблетки для посудомоечной машины Meine Liebe 21шт ML32224,569,409,https://www.detmir.ru/product/index/id/2829261/
4750315,Ершики Uviton для мытья трубочек Набо 3 штуки Арт.0297,206,,https://www.detmir.ru/product/index/id/4750315/
3668106,Гель для мытья посуды Neutrale гипоаллергенный без запаха и фосфатов Эко 400мл,399,220,https://www.detmir.ru/product/index/id/3668106/
4595054,Гель-бальзам для мытья посуды Synergetic Pure 0% 3.5л 103356,1299,,https://www.detmir.ru/product/index/id/4595054/
3877348,Таблетки для посудомоечной машины BioMio Bio-Total Эвкалипт 60шт,1789,,https://www.detmir.ru/product/index/id/3877348/
4675372,Гель для мытья овощей и фруктов AQA baby 500мл с 0месяцев,239,,https://www.detmir.ru/product/index/id/4675372/
3869087,Ершик для сосок Lubby 16895,125,,https://www.detmir.ru/product/index/id/3869087/
3798533,Гель для мытья посуды WONDER Lab Сливочные фрукты 3.78л,995,745,https://www.detmir.ru/product/index/id/3798533/
3112456,Ершик для бутылочки Dr Brown's Soft Touch AC055,665,,https://www.detmir.ru/product/index/id/3112456/
6801,Ершик для чистки вентиляционной системы Dr Brown's 4шт 620,429,,https://www.detmir.ru/product/index/id/6801/
3275531,Ершик для бутылочек Chicco 340728264,939,,https://www.detmir.ru/product/index/id/3275531/
3284549,Гель для мытья посуды Fairy 900мл 81714036,349,289,https://www.detmir.ru/product/index/id/3284549/
3112457,Ершик для бутылочки Dr Brown's Делюкс AC110,675,539,https://www.detmir.ru/product/index/id/3112457/
4880908,Таблетки для посудомоечной машины 30шт YokoSun 4602009765018,759,395,https://www.detmir.ru/product/index/id/4880908/
3292737,Гель для посуды Meine Liebe клюква и брусника 500мл,189,159,https://www.detmir.ru/product/index/id/3292737/
3335846,Средство для мытья посуды BioMio мандарин 750мл,415,329,https://www.detmir.ru/product/index/id/3335846/
4880903,Гель для мытья посуды YokoSun Алоэ вера 1л,469,329,https://www.detmir.ru/product/index/id/4880903/
3627031,Гель для мытья посуды фруктов овощей и игрушек Mepsi 550мл 0155,225,,https://www.detmir.ru/product/index/id/3627031/
3195555,Набор ершиков Lubby с присоской 2шт 13948,325,239,https://www.detmir.ru/product/index/id/3195555/
3413266,Ершик для бутылочек с губкой Babyono Голубой 720,306,254,https://www.detmir.ru/product/index/id/3413266/
4880909,Таблетки для посудомоечной машины YokoSun 100шт 4602009765032,2319,1089,https://www.detmir.ru/product/index/id/4880909/
3174037,Таблетки для посудомоечных машин Умкa бесфосфатные 28шт,659,,https://www.detmir.ru/product/index/id/3174037/
4233849,Средство для мытья посуды LION Chamgreen с содой и лимонной кислотой 965 мл,881,352,https://www.detmir.ru/product/index/id/4233849/
3163928,Щётка для мытья бутылочек и сосок BABOO 3в1 4-302,285,,https://www.detmir.ru/product/index/id/3163928/
4484880,Гель для посуды Zelenka с экстрактом яблока 0.5л,179,,https://www.detmir.ru/product/index/id/4484880/
246231,Ершик Canpol Babies Розовый 56/122,765,305,https://www.detmir.ru/product/index/id/246231/
3252846,Щётка для мытья бутылочек Medela 101037160,489,429,https://www.detmir.ru/product/index/id/3252846/
3470062,Пена для мытья посуды и игрушек WONDER Lab с 0месяцев 240мл,255,149,https://www.detmir.ru/product/index/id/3470062/
4003323,Средство для мытья посуды Лайма 5л концентрат Яблоко,886,505,https://www.detmir.ru/product/index/id/4003323/
3533416,Щётка для бутылочек Everyday baby черничный,1290,610,https://www.detmir.ru/product/index/id/3533416/
246211,Ершик Canpol Babies Зеленый 56/122,765,305,https://www.detmir.ru/product/index/id/246211/
3856237,Ершик ПОМА синий Пома,328,295,https://www.detmir.ru/product/index/id/3856237/
3599747,Средство ATTITUDE для овощей и фруктов Жидкость 800 мл,964,,https://www.detmir.ru/product/index/id/3599747/
3969407,Таблетки ATTITUDE Для посудомоечных машин 26 шт,1592,,https://www.detmir.ru/product/index/id/3969407/
4424704,Гель для мытья посуды WONDER Lab нейтральный 550мл,275,205,https://www.detmir.ru/product/index/id/4424704/
3810588,Средство для мытья посуды Солнце и луна Eco без запаха 0.5л,169,,https://www.detmir.ru/product/index/id/3810588/
3856212,Ершик ПОМА зеленый Пома,391,351,https://www.detmir.ru/product/index/id/3856212/
3292736,Гель для посуды Meine Liebe манго и лайм 500мл,189,,https://www.detmir.ru/product/index/id/3292736/
4108124,Пена для мытья посуды BioMio Bio-Foam Лемонграсс 350мл,409,,https://www.detmir.ru/product/index/id/4108124/
3275799,Средство для мытья посуды Наша Мама с ромашкой и алоэ вера гипоаллергенный 500мл,339,299,https://www.detmir.ru/product/index/id/3275799/
4472089,Набор ёршиков для бутылочек Happy Baby 2шт Olive 11001,329,,https://www.detmir.ru/product/index/id/4472089/
4424690,Пена для мытья овощей и фруктов WONDER Lab нейтральная 450мл,485,435,https://www.detmir.ru/product/index/id/4424690/
4424700,Гель для мытья посуды WONDER Lab яблочный цвет 1л,395,295,https://www.detmir.ru/product/index/id/4424700/
3731344,Таблетки для мытья посуды Jundo Active Oxygen в посудомоечных машинах с активным кислородом 30 шт,774,356,https://www.detmir.ru/product/index/id/3731344/
3413264,Набор ершиков Babyono 5штук Серый 735/03,642,,https://www.detmir.ru/product/index/id/3413264/
3292738,Гель для посуды Meine Liebe мелисса и лемонграсс 500мл,189,,https://www.detmir.ru/product/index/id/3292738/
3596992,Ершик Munchkin для бутылочек и сосок серый Munchkin,1120,560,https://www.detmir.ru/product/index/id/3596992/
3413265,Ершик для бутылочек Babyono с губкой 720 Серый,306,236,https://www.detmir.ru/product/index/id/3413265/
3413259,Набор ершиков Babyono для бутылочек и сосок Зеленый 728/02,490,408,https://www.detmir.ru/product/index/id/3413259/
4880902,Гель для мытья посуды YokoSun Лимон 1л,469,329,https://www.detmir.ru/product/index/id/4880902/
4424703,Гель для мытья посуды WONDER Lab сливочные фрукты 550мл,275,245,https://www.detmir.ru/product/index/id/4424703/
3257803,Ёршик Lubby круглый 21053,235,,https://www.detmir.ru/product/index/id/3257803/
3473556,Гель Top House для посудомоечных машин 720 мл,1019,703,https://www.detmir.ru/product/index/id/3473556/
3798532,Гель для мытья посуды WONDER Lab Нейтральный 3.78л,995,895,https://www.detmir.ru/product/index/id/3798532/
3473558,Порошок Top House для посудомоечных машин с активным кислородом 1 кг,920,598,https://www.detmir.ru/product/index/id/3473558/
4299669,Ершик Uviton для мытья бутылочек Lux 0145 мятный,258,229,https://www.detmir.ru/product/index/id/4299669/
4692761,Средство для мытья посуды CJ LION Charmgreen для овощей и фруктов Японский абрикос 1 кг,713,427,https://www.detmir.ru/product/index/id/4692761/
4692758,Средство для мытья посуды CJ LION Charmgreen bottle овощей и фруктов зеленый чай 3.1 кг,1999,1192,https://www.detmir.ru/product/index/id/4692758/
3117733,Ершик для бутылочек и сосок BabyGo BD-19097,179,129,https://www.detmir.ru/product/index/id/3117733/
3413260,Набор ершиков Babyono для бутылочек и сосок Розовый 728/03,490,408,https://www.detmir.ru/product/index/id/3413260/
3413263,Набор ершиков Babyono 5штук Зеленый 735/02,642,,https://www.detmir.ru/product/index/id/3413263/
3489835,Жидкость для мытья посуды ARAU 400мл 32065,609,439,https://www.detmir.ru/product/index/id/3489835/
3413262,Набор ершиков Babyono 5штук Голубой 735/01,642,,https://www.detmir.ru/product/index/id/3413262/
4424705,Гель для мытья рук и умывания WONDER Lab розовые персики 540мл,285,209,https://www.detmir.ru/product/index/id/4424705/
4546074,Набор ёршиков Baby Planet 8408,395,280,https://www.detmir.ru/product/index/id/4546074/
3413269,Ершик для бутылочек Babyono Голубой 721,240,,https://www.detmir.ru/product/index/id/3413269/
4424699,Гель для мытья посуды WONDER Lab жасмин и морская соль 1л,395,355,https://www.detmir.ru/product/index/id/4424699/
4595066,Гель-бальзам для мытья посуды Synergetic Сочный гранат-Абрикос 3.5л,1299,,https://www.detmir.ru/product/index/id/4595066/
4595055,Гель-бальзам для мытья посуды Synergetic Базилик-Cвежая мята 0.5л,269,,https://www.detmir.ru/product/index/id/4595055/
3473554,Экспресс-очиститель Top House для посудомоечных машин 250 мл,450,279,https://www.detmir.ru/product/index/id/3473554/
3885625,Ополаскиватель для всех видов посудомоечных машин Rossinka 500мл,189,,https://www.detmir.ru/product/index/id/3885625/
3374168,Ершик для бутылочек Nuk 2в1 с губкой Голубой 10720279,775,,https://www.detmir.ru/product/index/id/3374168/
3413268,Ершик для бутылочек Babyono Зеленый 721,240,,https://www.detmir.ru/product/index/id/3413268/
3413261,Набор ершиков Babyono для бутылочек и сосок Серый 728/04,519,,https://www.detmir.ru/product/index/id/3413261/
3858070,Соль для посудомоечных машин Jundo ионизированная серебром 3 кг,790,363,https://www.detmir.ru/product/index/id/3858070/
3664420,Гель для мытья посуды Neutrale гипоаллергенный без запаха и фосфатов для чувствительной кожи ЭКО 400мл,309,247,https://www.detmir.ru/product/index/id/3664420/
4695749,Бальзам для мытья посуды Nativica Защита кожи мицеллярный 400мл,209,,https://www.detmir.ru/product/index/id/4695749/
4424702,Гель для мытья посуды WONDER Lab жасмин и морская соль 550мл,275,205,https://www.detmir.ru/product/index/id/4424702/
3202957,Средство для мытья посуды LION Chamgreen концентрированное Розмарин запасной блок 860мл,529,339,https://www.detmir.ru/product/index/id/3202957/
4595061,Гель-бальзам для мытья посуды Synergetic Розовый грейпфрут-Специи 0.5л,269,,https://www.detmir.ru/product/index/id/4595061/
3473494,Таблетки Nordland для посудомоечных машин 32 шт,799,535,https://www.detmir.ru/product/index/id/3473494/
3665716,Средство Molecola для мытья фруктов и овощей 550 мл,411,250,https://www.detmir.ru/product/index/id/3665716/
4695748,Бальзам для мытья посуды Nativica мицеллярный 400мл,209,,https://www.detmir.ru/product/index/id/4695748/
4595064,Гель-бальзам для мытья посуды Synergetic Сочный гранат-Абрикос 0.5л,269,,https://www.detmir.ru/product/index/id/4595064/
3665685,Гель для мытья посуды Palmia Caramel с ароматом карамели 5 л,1613,951,https://www.detmir.ru/product/index/id/3665685/
4692754,Средство для мытья посуды CJ LION Charmgreen овощей и фруктов гранат 470 г,713,442,https://www.detmir.ru/product/index/id/4692754/
3619453,Ершики Мультидом для посуды 4шт,304,,https://www.detmir.ru/product/index/id/3619453/
3473560,Ополаскиватель Top House для посудомоечных машин 500 мл,410,258,https://www.detmir.ru/product/index/id/3473560/
3640011,Гель для мытья посуды INSEENSE 500мл,350,227,https://www.detmir.ru/product/index/id/3640011/
4484879,Гель для посуды Zelenka с экстрактом алоэ 5л,955,,https://www.detmir.ru/product/index/id/4484879/
3495915,Гель Кря-Кря для мытья посуды и игрушек 500 мл,312,292,https://www.detmir.ru/product/index/id/3495915/
4595056,Гель-бальзам для мытья посуды Synergetic Базилик-Свежая мята 1л,459,,https://www.detmir.ru/product/index/id/4595056/
3665683,Cредство для мытья посуды Palmia Cappuccino с ароматом капучино 5 л,1613,983,https://www.detmir.ru/product/index/id/3665683/
3413267,Ершик для бутылочек Babyono с губкой 720 Розовый,306,236,https://www.detmir.ru/product/index/id/3413267/
4595057,Гель-бальзам для мытья посуды Synergetic Базилик-Свежая мята 3.5л,1299,,https://www.detmir.ru/product/index/id/4595057/
3856211,Ершики ПОМА бирюзовый Пома,294,264,https://www.detmir.ru/product/index/id/3856211/
4875264,Гель для мытья посуды овощей и фруктов Meine Liebe 485мл,269,219,https://www.detmir.ru/product/index/id/4875264/
3413257,Набор ершиков Babyono NATURAL NURSING 736,1054,790,https://www.detmir.ru/product/index/id/3413257/
4053043,Гель для детской посуды Planeta Organica Organic People гипоалергенный 500мл,259,,https://www.detmir.ru/product/index/id/4053043/
3604481,Средство для посуды ATTITUDE Яблоко/Базилик Гель,815,,https://www.detmir.ru/product/index/id/3604481/
4595069,Гель-бальзам для мытья посуды Synergetic Эвкалипт-Горный чабрец 3.5л,1299,,https://www.detmir.ru/product/index/id/4595069/
4595063,Гель-бальзам для мытья посуды Synergetic Розовый грейпфрут-Специи 3.5л,1299,,https://www.detmir.ru/product/index/id/4595063/
3202951,Средство для мытья посуды овощей и фруктов LION Chamgreen Японский абрикос 960мл,499,315,https://www.detmir.ru/product/index/id/3202951/
3894706,Моющее средство BioBac против грибка и плесени с ионами серебра 750 мл,877,359,https://www.detmir.ru/product/index/id/3894706/
1180381,Ершик для бутылочек и сосок Мир Детства в ассортименте 19517,355,305,https://www.detmir.ru/product/index/id/1180381/
3604765,Ершик Munchkin для мытья поильников и бутылочек 4 шт Munchkin,1100,660,https://www.detmir.ru/product/index/id/3604765/
4784038,Ерш для мытья посуды Доляна с деревянной ручкой,489,220,https://www.detmir.ru/product/index/id/4784038/
4424707,Гель для посуды WONDER Lab антибактериальным комплексом апельсин и лаванда 550мл,275,,https://www.detmir.ru/product/index/id/4424707/
3470061,Гель для мытья посуды и игрушек WONDER Lab с 0месяцев 480мл,195,135,https://www.detmir.ru/product/index/id/3470061/
3251305,Средство для мытья посуды Мир Детства Гипоаллергенное 500мл,309,,https://www.detmir.ru/product/index/id/3251305/
2267701,Средство для мытья посуды Synergetic 500мл,229,129,https://www.detmir.ru/product/index/id/2267701/
3885600,Гель для посуды сосок бутылочек Rossinka baby 500мл,209,,https://www.detmir.ru/product/index/id/3885600/
3202958,Средство для мытья посуды LION Chamgreen концентрированное Розмарин 450мл,479,295,https://www.detmir.ru/product/index/id/3202958/
4692772,Средство для мытья посуды CJ LION Charmgreen pump овощей и фруктов зеленый чай 1 кг,927,558,https://www.detmir.ru/product/index/id/4692772/
3885602,Гель для всех видов посудомоечных машин Rossinka 1000мл,669,,https://www.detmir.ru/product/index/id/3885602/
4595058,Гель-бальзам для мытья посуды Synergetic Розмарин-Листья смородины 0.5л,269,,https://www.detmir.ru/product/index/id/4595058/
3682359,Набор ершиков Солнце и луна 2шт 7471,205,,https://www.detmir.ru/product/index/id/3682359/
3827592,Набор от накипи Anti bọt в бытовых приборах 50 г и 35 таблеток для стиральных машин,429,218,https://www.detmir.ru/product/index/id/3827592/
3543315,Таблетки TOPPERR в водорастворимой оболочке для посудомоечных машин 24шт 3320,709,567,https://www.detmir.ru/product/index/id/3543315/
4595065,Гель-бальзам для мытья посуды Synergetic Сочный гранат-Абрикос 1л,459,,https://www.detmir.ru/product/index/id/4595065/
4692432,Таблетки FeedBack для посудомоечных машин ALL in 1 30 шт.,672,,https://www.detmir.ru/product/index/id/4692432/
4595062,Гель-бальзам для мытья посуды Synergetic Розовый грейпфрут-Специи 1л,459,,https://www.detmir.ru/product/index/id/4595062/
